{
  "$schema": "https://specdev.local/schema/07_nfrs.schema.json",
  "id": "nfrs-core",
  "owner": "ops",
  "created_at": "2025-10-17T00:00:00Z",
  "nfrs": [
    {
      "nfr_id": "nfr-login-latency-p50",
      "category": "latency",
      "metric": "p50_login_latency_ms",
      "target": 150,
      "unit": "ms",
      "measurement_method": "HTTP timer on /v1/login measured in CI and prod",
      "stage": "prod",
      "owner": "ops",
      "trace": [
        {
          "type": "api",
          "id": "api-login"
        }
      ]
    }
  ]
}
