{
  "$schema": "https://specdev.local/schema/07_nfrs.schema.json",
  "id": "nfrs-catalog",
  "owner": "api",
  "created_at": "2025-01-01T00:00:00Z",
  "nfrs": [
    {
      "nfr_id": "nfr-latency-p95-response-time",
      "category": "latency",
      "metric": "p95 response time",
      "target": 200,
      "unit": "ms",
      "measurement_method": "PromQL: histogram_quantile(0.95, sum(rate(http_request_duration_seconds_bucket{job=\"api-server\"}[5m])) by (le))",
      "stage": "prod",
      "owner": "api",
      "trace": [
        {
          "type": "fr",
          "id": "fr-user-login"
        }
      ]
    }
  ]
}
